<?xml version="1.0" encoding="UTF-8"?>
<pracownik xmlns:xsi="http://www.w3.org/2001/XMLSchema-instance" xsi:noNamespaceSchemaLocation="zad1.xsd">
	<imie>Bartosz</imie>
	<nazwisko>Jag≈Çowski</nazwisko>
	<wiek>10</wiek>
	<data_urodzenia>11.11.11<data_urodzenia>
	<pesja>15000<pensja>
</pracownik>